{
  "schema_version": "1",
  "job_id": "job-rich-001",
  "device_id": "paperbridge-dev-001",
  "created_at": "2026-08-02T00:00:00Z",
  "content": {
    "kind": "receipt",
    "blocks": [
      {
        "type": "text",
        "text": "PAPERBRIDGE",
        "align": "center",
        "bold": true,
        "underline": false,
        "width_multiplier": 2,
        "height_multiplier": 2
      },
      {
        "type": "text",
        "text": "Send something real",
        "underline": true
      },
      {
        "type": "text",
        "text": "xxxxxxxxxxxxxxxxxxxxxxxxxxxxxxxxxxxxxxxxxxxxxxxxxxxxxxxxxxxxxxxxxxxxxxxxxxxxxxxxxxxxxxxxxxxxxxxxxxxxxx"
      },
      {
        "type": "rule",
        "character": "-"
      },
      {
        "type": "qr",
        "data": "https://paperbridge.dev/r/xxxxxxxxxxxxxxxxxxxxxxxxxxxxxxxxxxxxxxxxxxxxxxxxxxxxxxxxxxxxxxxxxxxxxxxxxxxxxxxxxxxxxxxxxxxxxxxxxxxxxxxxxxxxxxxxxxxxxxxxxxxxxxxxxxxxxxxxxxxxxxxxxxxxxxxxxxxxxxxxxxxxxxxxxxxxxxxxxxxxxxxxxxxxxxxxxxxxxxxxxxxxxxxxxxxxxxxxxxxxxxxxxxxxxx"
      },
      {
        "type": "feed",
        "lines": 2
      }
    ]
  }
}
