{
  "schema_version": "1",
  "job_id": "job-rule-001",
  "device_id": "paperbridge-dev-001",
  "created_at": "2026-08-01T00:00:00Z",
  "content": {
    "kind": "receipt",
    "blocks": [
      { "type": "text", "text": "TOTAL" },
      { "type": "rule", "character": "-" },
      { "type": "feed", "lines": 1 }
    ]
  }
}
