{
  "schema_version": "1",
  "job_id": "job-qr-sized-001",
  "device_id": "paperbridge-dev-001",
  "created_at": "2026-08-02T00:00:00Z",
  "content": {
    "kind": "receipt",
    "blocks": [
      {
        "type": "qr",
        "data": "https://example.com/paperbridge",
        "module_size": 5
      }
    ]
  }
}
